{"$id":"urn:night-voyager:schema:evidence-loop-public-source-manifest-fragment-v1","$schema":"https://json-schema.org/draft/2020-12/schema","additionalProperties":false,"properties":{"a3_native_ingest_binding":{"additionalProperties":false,"properties":{"mapping_requirement":{"minLength":1,"type":"string"},"required_actual_evidence_descriptor_fields":{"const":["source_id","publication_id","publication_revision","content_fingerprint","evidence_text_sha256","original_utf8_bytes","locator"],"type":"array"},"stable_commitment_fields":{"const":["publication_revision","content_fingerprint","evidence_text_sha256","original_utf8_bytes","locator"],"type":"array"},"trace_only_fields":{"const":["source_id","publication_id","run_id","evidence_id"],"type":"array"}},"required":["required_actual_evidence_descriptor_fields","stable_commitment_fields","trace_only_fields","mapping_requirement"],"type":"object"},"admission_policy":{"additionalProperties":false,"properties":{"eligible_author_revision":{"const":3,"type":"integer"},"eligible_source_representation":{"const":"revision_3_producer_native_pdf","type":"string"},"rejected_pre_admission_author_revisions":{"const":[1,2],"type":"array"},"rejection_paths":{"items":{"minLength":1,"type":"string"},"minItems":1,"type":"array","uniqueItems":true}},"required":["eligible_author_revision","eligible_source_representation","rejected_pre_admission_author_revisions","rejection_paths"],"type":"object"},"canonical_source_algorithm":{"additionalProperties":false,"properties":{"algorithm":{"const":"sha256","type":"string"},"dataset_source_id_algorithm":{"additionalProperties":false,"properties":{"algorithm":{"const":"uuid5","type":"string"},"name_input":{"minLength":1,"type":"string"},"namespace_uuid":{"format":"uuid","type":"string"}},"required":["algorithm","namespace_uuid","name_input"],"type":"object"},"encoding":{"minLength":1,"type":"string"},"name":{"const":"evaluation_canonical_source_id.v2","type":"string"},"projection_keys":{"const":["canonical_url","content_sha256","expected_extracted_text_sha256","expected_extracted_utf8_bytes","media_type","producer_native_proof_sha256","producer_profile_id","relative_path"],"type":"array"}},"required":["name","algorithm","projection_keys","encoding","dataset_source_id_algorithm"],"type":"object"},"canonicalization_id":{"const":"night-voyager.slice0.compact-sorted-utf8-lf.v1","type":"string"},"content_trust":{"const":"untrusted_evidence","type":"string"},"schema_version":{"const":"night-voyager.evidence-loop-public-source-manifest-fragment.v1","type":"string"},"sources":{"items":{"additionalProperties":false,"properties":{"byte_length":{"minimum":1,"type":"integer"},"canonical_url":{"format":"uri","type":"string"},"content_sha256":{"pattern":"^[0-9a-f]{64}$","type":"string"},"dataset_source_id":{"format":"uuid","type":"string"},"evaluation_canonical_source_id":{"pattern":"^[0-9a-f]{64}$","type":"string"},"expected_extracted_text_sha256":{"pattern":"^[0-9a-f]{64}$","type":"string"},"expected_extracted_utf8_bytes":{"minimum":1,"type":"integer"},"expected_locator":{"additionalProperties":false,"properties":{"end":{"const":1,"type":"integer"},"kind":{"const":"page","type":"string"},"start":{"const":1,"type":"integer"}},"required":["kind","start","end"],"type":"object"},"expected_publication_revision":{"const":1,"type":"integer"},"media_type":{"const":"application/pdf","type":"string"},"producer":{"additionalProperties":false,"properties":{"generator":{"additionalProperties":false,"properties":{"contract_sha256":{"pattern":"^[0-9a-f]{64}$","type":"string"},"font":{"const":"helv","type":"string"},"fontsize":{"const":12,"type":"integer"},"input_normalization":{"const":"CRLF and CR to LF, then remove exactly one terminal LF","type":"string"},"metadata_author":{"const":"Night Voyager dataset author","type":"string"},"metadata_subject":{"const":"Provider-free public-safe Slice 0 source","type":"string"},"metadata_title":{"minLength":1,"type":"string"},"page_count":{"const":1,"type":"integer"},"page_height":{"const":792,"type":"integer"},"page_width":{"const":612,"type":"integer"},"profile_id":{"const":"night-voyager.slice0.producer-native-pdf.v1","type":"string"},"save":{"additionalProperties":false,"properties":{"clean":{"const":true},"deflate":{"const":true},"garbage":{"const":4,"type":"integer"},"no_new_id":{"const":true},"reopen_or_resave":{"const":false}},"required":["garbage","clean","deflate","no_new_id","reopen_or_resave"],"type":"object"},"textbox":{"const":[72,72,540,720],"type":"array"}},"required":["profile_id","contract_sha256","input_normalization","page_count","page_width","page_height","textbox","font","fontsize","metadata_title","metadata_author","metadata_subject","save"],"type":"object"},"profile":{"additionalProperties":false,"properties":{"direct_extractor":{"const":"PyMuPDFPdfExtractor","type":"string"},"extraction_mode":{"const":"pymupdf-text","type":"string"},"native_pipeline":{"const":["ingest_file","search_library_v2","read_evidence_v1"],"type":"array"},"profile_id":{"const":"night-voyager.slice0.producer-native-pdf.v1","type":"string"}},"required":["profile_id","extraction_mode","direct_extractor","native_pipeline"],"type":"object"},"pymupdf":{"additionalProperties":false,"properties":{"binding_version":{"const":"1.27.2.3","type":"string"},"distribution_name":{"const":"PyMuPDF","type":"string"},"distribution_version":{"const":"1.27.2.3","type":"string"}},"required":["distribution_name","distribution_version","binding_version"],"type":"object"},"release":{"additionalProperties":false,"properties":{"name":{"const":"multimodal-knowledge-engine","type":"string"},"peeled_commit":{"const":"d258c10dc40bd9eccd67c858b56f4e4cf5fe4610","type":"string"},"tag":{"const":"v0.1.5","type":"string"},"tag_object":{"const":"1ca0a0b348638369e8407270ca5f363b0e551a9e","type":"string"},"tree":{"const":"22756fdfa8ef131d3e28fc2a44acc3f2b6fa32f0","type":"string"},"version":{"const":"0.1.5","type":"string"}},"required":["name","version","tag","tag_object","peeled_commit","tree"],"type":"object"},"runtime":{"additionalProperties":false,"properties":{"architecture":{"const":"arm64","type":"string"},"implementation":{"const":"CPython","type":"string"},"platform":{"additionalProperties":false,"properties":{"mac_ver":{"minLength":1,"type":"string"},"machine":{"const":"arm64","type":"string"},"release":{"minLength":1,"type":"string"},"system":{"const":"Darwin","type":"string"}},"required":["system","release","machine","mac_ver"],"type":"object"},"python_version":{"const":"3.13.12","type":"string"}},"required":["implementation","python_version","architecture","platform"],"type":"object"},"wheel":{"additionalProperties":false,"properties":{"byte_length":{"const":23278238,"type":"integer"},"filename":{"const":"pymupdf-1.27.2.3-cp310-abi3-macosx_11_0_arm64.whl","type":"string"},"sha256":{"const":"660d93cb6da5bbddf11d3982ae27745dd3a9902d9f24cdb69adab83962294b5a","type":"string"},"tag":{"const":"cp310-abi3-macosx_11_0_arm64","type":"string"}},"required":["filename","byte_length","sha256","tag"],"type":"object"}},"required":["release","profile","runtime","pymupdf","wheel","generator"],"type":"object"},"producer_native_proof_commitment":{"additionalProperties":false,"properties":{"basename":{"minLength":1,"type":"string"},"byte_length":{"minimum":1,"type":"integer"},"sha256":{"pattern":"^[0-9a-f]{64}$","type":"string"}},"required":["basename","byte_length","sha256"],"type":"object"},"redistribution_class":{"const":"public_safe_synthetic","type":"string"},"relative_path":{"pattern":"^mke-corpus/rf-[0-9a-f]{8}\\.pdf$","type":"string"}},"required":["dataset_source_id","relative_path","byte_length","content_sha256","expected_extracted_utf8_bytes","expected_extracted_text_sha256","expected_locator","expected_publication_revision","canonical_url","evaluation_canonical_source_id","media_type","redistribution_class","producer","producer_native_proof_commitment"],"type":"object"},"maxItems":4,"minItems":4,"type":"array","uniqueItems":true}},"required":["schema_version","canonicalization_id","content_trust","canonical_source_algorithm","a3_native_ingest_binding","admission_policy","sources"],"title":"Night Voyager Slice 0 Public Source Manifest Fragment V1 Revision 3","type":"object"}
