{"a3_native_ingest_binding":{"mapping_requirement":"A3 must read actual revision-3 native descriptors, require all listed fields, retain source_id/publication_id/run_id/evidence_id only as per-run trace data, and admit a source only when every stable commitment equals this author package.","required_actual_evidence_descriptor_fields":["source_id","publication_id","publication_revision","content_fingerprint","evidence_text_sha256","original_utf8_bytes","locator"],"stable_commitment_fields":["publication_revision","content_fingerprint","evidence_text_sha256","original_utf8_bytes","locator"],"trace_only_fields":["source_id","publication_id","run_id","evidence_id"]},"admission_policy":{"eligible_author_revision":3,"eligible_source_representation":"revision_3_producer_native_pdf","rejected_pre_admission_author_revisions":[1,2],"rejection_paths":["content_fingerprint_mismatch","evidence_text_sha256_mismatch","locator_mismatch","native_proof_commitment_mismatch","original_utf8_bytes_mismatch","publication_revision_mismatch","source_not_in_revision_3_manifest","trace_identity_missing"]},"canonical_source_algorithm":{"algorithm":"sha256","dataset_source_id_algorithm":{"algorithm":"uuid5","name_input":"evaluation_canonical_source_id","namespace_uuid":"73dc9ba5-a697-558d-84a4-adedb01166ec"},"encoding":"compact sorted-key UTF-8 JSON, no ASCII escaping, no BOM, no terminator","name":"evaluation_canonical_source_id.v2","projection_keys":["canonical_url","content_sha256","expected_extracted_text_sha256","expected_extracted_utf8_bytes","media_type","producer_native_proof_sha256","producer_profile_id","relative_path"]},"canonicalization_id":"night-voyager.slice0.compact-sorted-utf8-lf.v1","content_trust":"untrusted_evidence","schema_version":"night-voyager.evidence-loop-public-source-manifest-fragment.v1","sources":[{"byte_length":1503,"canonical_url":"https://example.org/nv-synthetic/0a6f5c9d","content_sha256":"b1755194bb04e245749b589a7556be9279f37aab68707d4bf030a7902c295d13","dataset_source_id":"4e9a820a-41cf-5db3-9d89-620c9033cab9","evaluation_canonical_source_id":"62892cda47fa8d5168a24301f43884712fede0d4d22f09e89d45e6ff781f4c22","expected_extracted_text_sha256":"2281b574e63fa3e57c6cc86ef4b95dd4234598ef848dfdf317db133e7cdfaf1b","expected_extracted_utf8_bytes":842,"expected_locator":{"end":1,"kind":"page","start":1},"expected_publication_revision":1,"media_type":"application/pdf","producer":{"generator":{"contract_sha256":"e16d64a048da558a84b2f3ab2d9453718db189fb343ad67d85c86523e06a8873","font":"helv","fontsize":12,"input_normalization":"CRLF and CR to LF, then remove exactly one terminal LF","metadata_author":"Night Voyager dataset author","metadata_subject":"Provider-free public-safe Slice 0 source","metadata_title":"Night Voyager Slice 0 synthetic source: rf-0a6f5c9d.pdf","page_count":1,"page_height":792,"page_width":612,"profile_id":"night-voyager.slice0.producer-native-pdf.v1","save":{"clean":true,"deflate":true,"garbage":4,"no_new_id":true,"reopen_or_resave":false},"textbox":[72,72,540,720]},"profile":{"direct_extractor":"PyMuPDFPdfExtractor","extraction_mode":"pymupdf-text","native_pipeline":["ingest_file","search_library_v2","read_evidence_v1"],"profile_id":"night-voyager.slice0.producer-native-pdf.v1"},"pymupdf":{"binding_version":"1.27.2.3","distribution_name":"PyMuPDF","distribution_version":"1.27.2.3"},"release":{"name":"multimodal-knowledge-engine","peeled_commit":"d258c10dc40bd9eccd67c858b56f4e4cf5fe4610","tag":"v0.1.5","tag_object":"1ca0a0b348638369e8407270ca5f363b0e551a9e","tree":"22756fdfa8ef131d3e28fc2a44acc3f2b6fa32f0","version":"0.1.5"},"runtime":{"architecture":"arm64","implementation":"CPython","platform":{"mac_ver":"26.5.2","machine":"arm64","release":"25.5.0","system":"Darwin"},"python_version":"3.13.12"},"wheel":{"byte_length":23278238,"filename":"pymupdf-1.27.2.3-cp310-abi3-macosx_11_0_arm64.whl","sha256":"660d93cb6da5bbddf11d3982ae27745dd3a9902d9f24cdb69adab83962294b5a","tag":"cp310-abi3-macosx_11_0_arm64"}},"producer_native_proof_commitment":{"basename":"native-source-proof-v1.json","byte_length":8717,"sha256":"a81b1100727aee498eec5194d7da6f18b4059e337644b44348e2298e0eb97df5"},"redistribution_class":"public_safe_synthetic","relative_path":"mke-corpus/rf-0a6f5c9d.pdf"},{"byte_length":1232,"canonical_url":"https://example.org/nv-synthetic/31c7b2e4","content_sha256":"8ada7b1d620b5d3bce84a5c9226b40c2f9731083e315245d9c8f13fc27f6c565","dataset_source_id":"35f8bf99-1817-566f-9eeb-0d074c9684b3","evaluation_canonical_source_id":"2e50905c38d6633a7ca90bc6b96ddf7e3ac70fd63037ec49dbcd23796c1288ea","expected_extracted_text_sha256":"4b82173e14f9eb1e5502708fbc154aa8be1f9ce98502e169a0aa34afb47caa37","expected_extracted_utf8_bytes":470,"expected_locator":{"end":1,"kind":"page","start":1},"expected_publication_revision":1,"media_type":"application/pdf","producer":{"generator":{"contract_sha256":"e16d64a048da558a84b2f3ab2d9453718db189fb343ad67d85c86523e06a8873","font":"helv","fontsize":12,"input_normalization":"CRLF and CR to LF, then remove exactly one terminal LF","metadata_author":"Night Voyager dataset author","metadata_subject":"Provider-free public-safe Slice 0 source","metadata_title":"Night Voyager Slice 0 synthetic source: rf-31c7b2e4.pdf","page_count":1,"page_height":792,"page_width":612,"profile_id":"night-voyager.slice0.producer-native-pdf.v1","save":{"clean":true,"deflate":true,"garbage":4,"no_new_id":true,"reopen_or_resave":false},"textbox":[72,72,540,720]},"profile":{"direct_extractor":"PyMuPDFPdfExtractor","extraction_mode":"pymupdf-text","native_pipeline":["ingest_file","search_library_v2","read_evidence_v1"],"profile_id":"night-voyager.slice0.producer-native-pdf.v1"},"pymupdf":{"binding_version":"1.27.2.3","distribution_name":"PyMuPDF","distribution_version":"1.27.2.3"},"release":{"name":"multimodal-knowledge-engine","peeled_commit":"d258c10dc40bd9eccd67c858b56f4e4cf5fe4610","tag":"v0.1.5","tag_object":"1ca0a0b348638369e8407270ca5f363b0e551a9e","tree":"22756fdfa8ef131d3e28fc2a44acc3f2b6fa32f0","version":"0.1.5"},"runtime":{"architecture":"arm64","implementation":"CPython","platform":{"mac_ver":"26.5.2","machine":"arm64","release":"25.5.0","system":"Darwin"},"python_version":"3.13.12"},"wheel":{"byte_length":23278238,"filename":"pymupdf-1.27.2.3-cp310-abi3-macosx_11_0_arm64.whl","sha256":"660d93cb6da5bbddf11d3982ae27745dd3a9902d9f24cdb69adab83962294b5a","tag":"cp310-abi3-macosx_11_0_arm64"}},"producer_native_proof_commitment":{"basename":"native-source-proof-v1.json","byte_length":8717,"sha256":"a81b1100727aee498eec5194d7da6f18b4059e337644b44348e2298e0eb97df5"},"redistribution_class":"public_safe_synthetic","relative_path":"mke-corpus/rf-31c7b2e4.pdf"},{"byte_length":1148,"canonical_url":"https://example.org/nv-synthetic/58d1a903","content_sha256":"bc28d32827be0fc1ec12f22d73ac01484844bd39aebce2db50815b2a879fe193","dataset_source_id":"e11b54a9-00df-578e-b867-2540c8b7dd87","evaluation_canonical_source_id":"3b7520ab458a141f3a186abdfa8fbfc1d17baf6ffbd3527809c3d216d647217e","expected_extracted_text_sha256":"ec8f5c516ed9805d84ec3f8763e339e46da319440fc9941bcea56f9c492d5188","expected_extracted_utf8_bytes":315,"expected_locator":{"end":1,"kind":"page","start":1},"expected_publication_revision":1,"media_type":"application/pdf","producer":{"generator":{"contract_sha256":"e16d64a048da558a84b2f3ab2d9453718db189fb343ad67d85c86523e06a8873","font":"helv","fontsize":12,"input_normalization":"CRLF and CR to LF, then remove exactly one terminal LF","metadata_author":"Night Voyager dataset author","metadata_subject":"Provider-free public-safe Slice 0 source","metadata_title":"Night Voyager Slice 0 synthetic source: rf-58d1a903.pdf","page_count":1,"page_height":792,"page_width":612,"profile_id":"night-voyager.slice0.producer-native-pdf.v1","save":{"clean":true,"deflate":true,"garbage":4,"no_new_id":true,"reopen_or_resave":false},"textbox":[72,72,540,720]},"profile":{"direct_extractor":"PyMuPDFPdfExtractor","extraction_mode":"pymupdf-text","native_pipeline":["ingest_file","search_library_v2","read_evidence_v1"],"profile_id":"night-voyager.slice0.producer-native-pdf.v1"},"pymupdf":{"binding_version":"1.27.2.3","distribution_name":"PyMuPDF","distribution_version":"1.27.2.3"},"release":{"name":"multimodal-knowledge-engine","peeled_commit":"d258c10dc40bd9eccd67c858b56f4e4cf5fe4610","tag":"v0.1.5","tag_object":"1ca0a0b348638369e8407270ca5f363b0e551a9e","tree":"22756fdfa8ef131d3e28fc2a44acc3f2b6fa32f0","version":"0.1.5"},"runtime":{"architecture":"arm64","implementation":"CPython","platform":{"mac_ver":"26.5.2","machine":"arm64","release":"25.5.0","system":"Darwin"},"python_version":"3.13.12"},"wheel":{"byte_length":23278238,"filename":"pymupdf-1.27.2.3-cp310-abi3-macosx_11_0_arm64.whl","sha256":"660d93cb6da5bbddf11d3982ae27745dd3a9902d9f24cdb69adab83962294b5a","tag":"cp310-abi3-macosx_11_0_arm64"}},"producer_native_proof_commitment":{"basename":"native-source-proof-v1.json","byte_length":8717,"sha256":"a81b1100727aee498eec5194d7da6f18b4059e337644b44348e2298e0eb97df5"},"redistribution_class":"public_safe_synthetic","relative_path":"mke-corpus/rf-58d1a903.pdf"},{"byte_length":1169,"canonical_url":"https://example.org/nv-synthetic/c42e7d18","content_sha256":"6b01d4115833283da156d6c9deef5ddca41d3c722843af5428b145f0547fff70","dataset_source_id":"56491b2c-0b27-5b8c-9aee-82b1a3e1e91f","evaluation_canonical_source_id":"c0abce693988ad95dca24092971d3fbe9e4ab685074c9a420123c1de961a9f5a","expected_extracted_text_sha256":"a3eeb1949694f365130685c47390eaeff573cf33cd170f6431321d91782d980e","expected_extracted_utf8_bytes":355,"expected_locator":{"end":1,"kind":"page","start":1},"expected_publication_revision":1,"media_type":"application/pdf","producer":{"generator":{"contract_sha256":"e16d64a048da558a84b2f3ab2d9453718db189fb343ad67d85c86523e06a8873","font":"helv","fontsize":12,"input_normalization":"CRLF and CR to LF, then remove exactly one terminal LF","metadata_author":"Night Voyager dataset author","metadata_subject":"Provider-free publi